"I am always apprehensive about buying things I want to last from Amazon, it's hit or miss from some of these brands. These turned out to be a worthy purchase! The quality is excellent, definitely 18/10 because of the weight. So far no rusting, discoloration or stains from dishwashing. We love the hammered pattern which is unnoticeable to the touch when in the hand. No sharp edges or unevenness. They have slightly scratched from daily use, but they are faintly visible, just a natural part of owning silverware (or anything). My only complaint, and it's a small one, is that I don't like the brand logo printed on the back of the silverware, but that's just my personal preference."
"Short and simple – this set has vastly surpassed my expectations.  My first impression after opening the box was how gorgeous the hammered handles are. I absolutely love their finish and design. Being that it was just about dinner time, this was a perfect opportunity to put them to the test.  The utensils are sized just right, and their weight was just perfect. This set feels heavy, but not overly heavy and definitely didn't feel flimsy. Also, the utensils are significantly more comfortable than my Mikasa set.  The knife was well balanced and surprisingly sharp. While this isn’t a steak knife (I would not be surprised if it cut through steak!), it was much better than I would have expected from a stainless dinner knife.  This is a phenomenal set at a great value. I love the finish and design of the set. The quality is on par or better than some fancy boutique sets that cost more than double, especially since some of those are nowhere near as comfortable as this set. I have a feeling I’m going to regret not ordering the 40 piece set."
"This is a lovely set of stainless flatware. Every part of the individual pieces are smooth, the hammered finish is gorgeous (and bright/shiny if that is what you are looking for). The set is oversized, the spoons have larger than typical bowls so factor that in. Each piece is heavy. Much more weight than I expected. If you are looking for a heft, a shiny textured modern finish, and larger-scale set of quality, you might want to give this set serious consideration if it fits your criteria. Also, it came in a quality well-made box with each piece in a plastic protective sleeve, so if you are giving this as a gift you can be proud of its presentation. It does NOT include serving pieces but I didn't want them, so that was a plus for me."
"I never thought I would be raving about a set of silverware at 20 years old but I LOVE these! So clean, such a nice design, caked on food comes right off. 10/10 recommend this set. They also match perfectly to the silver hammered knife set that Cuisinart sells!!"
"I like this flatware very much. It is heavy, well balanced and even the knives don't show any sign of rust on their sharp blades after many passes through the dishwasher. The very shiny hammered pattern goes around the entire handle of the spoons, forks and knives. I highly recommend."
Loved the look and feel. Very heavy and well crafted. Will be buying the serving pieces next. Wide blade on knife makes cutting and spreading butter or jam easy
I like the weight. I hate cheap flimsy silverware and this set is beautiful. Definitely would make a very nice gift. I don’t put the knives in the dishwasher like the manufacturer suggests. It’s held up great and the hammered look is really pretty.
"These are great. There beautiful, sturdy a nice weight but not heavy, the spoons are a great size for cearial"
"High quality and well packed. The size of the spoon and small forks are much larger than what I used to. Probably American have larger then Europe... For me, the spoons are almost as a size as a regular cup, see attached image. At the right, other brands small cup and small fork."
"Love this set. Sturdy, stylish, great quality"
Love this flatware!!! The hammered look is beautiful
We love this set they are beautiful and sturdy. Already ordered the serving set.
Great quality. Pretty.
"So far so good, comes out nice from the dishwasher."
Beautiful and sturdy.
Nice and heavy. They are beautiful!
Beautiful hammered stainless dinner ware. Looks better than most everyday ware. Real class!
They were nice.... heavy ! Look pretty.. however! They rusted ! The very first time I washed! I wouldn’t buy . You can find better for the same price if not cheaper  Update! Since I’ve left this review I’ve revived a email from the company and they informed me that the knives were not 18/10 because they need their sharp ridges . They apologized And offered to send out new ones .
My mother had these and liked them so ordered
"Hudson Essentials claims their stainless steel silverware is 18/10, but it seemed much lighter in weight than the Crate & Barrel Mesa version or the Oneida Cabria version. The Hudson dinner forks are quite big and the salad fork is too large as well. The serving pieces are huge and the cake server and cake knife are gigantic! It's as though the pieces were made for basketball players with very large hands. Also, the hammering is not consistent. It should be more defined. If the lighter weight, the large size of the pieces and inconsistent hammering are not a problem, it could be a worthwhile purchase as it is much less money. I ended up getting the Oneida Cabria which looks and feels better, but has issues as well."
"I absolutely LOVE this set! I hesitated buying for a couple weeks after reading a few reviews that said the set rusts. However, I loved the look and thought I would buy and see for myself. I purchased nearly 3 months ago and I haven't had any rust at all. I never soak them but I do put them in the dishwasher with no issues. They come out looking flawless and beautiful every time!! They are substantial and have decent weight to them...they do not look or feel cheap!! I highly recommend anyone thinking about getting the set to just buy, you won't be disappointed! I first ordered a set of 8 and loved them so much, I bought another set of 4!"
Love this priduct high quslity
"This company has excellent customer service and integrity, and for that reason alone I would buy from them again. I had an issue with the first order and they contacted me on their own to correct the situation, and sent me a replacement immediately. The replacement set was perfect. I can only imagine that the issue I encountered with the first order was uncommon. This set is gorgeous and well manufactured with a substantial weight to them. The finish is sleek and shiny, and they wash up beautifully."
"Really good flatware, solid weight and edges are soft - cheap flatware has sharp edges on the handles but these are nicely rounded just enough. I threw everything in the dishwasher except the knives and no sign of rust in first wash. I am heeding the seller's advice to hand wash the knives because the serrated blades are not 18/10."
Already rusting in some spots .... save your money complete junk
"So far I am very happy with this silverware. I have been using bits and pieces of several sets and to open my silverware drawer and see this beautiful silverware is so nice. I read that some folks said that the knives rusted, well I have seen no sign of rust as yet. Every piece is shiny and worth the money."
"After watching my flatware disappear mysteriously over the years, it was time for a new set. Upon the reviews of this Hudson set, I took a chance and ordered one. This set exceeded my expectations. I love eating from these durable, beautiful utensils everyday. They are gorgeous."
"I bought this flatware in October. The butter knives are all scratched upon the tips, apparently from going through the dishwasher. I have never owned a set of tableware that did this. I would send them back if I could. Buyer beware."
This is such heavy and nice flatware I always read the bad reviews first and if I can live with them I will buy The is worth the price
"These are great I love them. They are very sturdy, and thick. Way better then the cheep Wally world ones. BUT if your wife is anything like mine and she likes the ""little forks"" vs the big forks. This set has little forks that are actually the same size as the ""big forks"" she doesn't like. And this sets big forks or ""dinner forks "" are massive. But, I like them just fine."
I’ve had the flat wear for about six weeks now and the pieces remain a shiny today as they did on day one. It’s well-balanced for your hand and the weight is perfect. I didn’t think I would like the hammered look as much as I do. I’d recommend this product. My only negative is that there were no serving pieces included.
The weight and feel are exactly what I was looking for. The nice restaurant feel but at home. The texture is enough to grip but not so much that it is distracting. The weight is enough that you know you do not fear bending the fork or spoon if you apply pressure. Overall I am very happy with this purchase.
"Love this set! Would buy again, now looking forward to purchasing the service set as well! Beautiful for the price, truly a mirror finish. Lovely on my table!"
Some of the pieces are rusting on the handles after dishwasher use. This seems really odd for this level of stainless steel. This is after probably half a dozen washes at most.
"Good looking, and seem to be a good value for the money, however I have only been using them for a couple months. I will be monitoring. Also, the pieces have nice weight to them and are as pictured, if not more pleasing in person."
"Wow, that is the first word out of everyone's mouth when they see them. They are very thick, sturdy and stylish! It is a huge bonus that these are dishwasher safe and do not discolor."
I’m extremely satisfied with this flatware. It is beautiful and well-made. I would recommend to anyone who may be on the fence about whether or not to purchase these utensils.
"Have ""used"" for 2 weeks now. Quality throughout the set is excellent. They have been through the dishwasher 4-5 times now and look as good as new if not better. Very happy with my purchase. I have no problem recommending this product as I feel I got my moneys worth."
These are much nicer than any set I have sever owned!! Heavy set and does not bend like other sets do. Also very nice looking. Hammered design on both sides of every piece.
"Great set! Nice and sturdy, heavy enough they don’t feel cheap. Had held up well with daily use and dishwasher."
Love my silverware. So much wish I had known about this I would have been ordered them years ago. I have been telling everyone that I know about them. Hopefully they will order them some. So Thank you very much. Oh buy the way the people that have seen them think that I have paid hundreds of dollars for them. Until I told the real price they said I have to get me some ....!!!💕❤️👏👏👏
Fantastic product. Nice and sturdy. No give at all. Spoons pass the hard ice cream test! I found a box of service for 4 at Khols for more than double what I paid for this service for 8 at Amazon. Excellent product and an even better value!
I love this silverware! This silverware set looks even better in person than the pictures. They feel really good in the hand. The weight and thickness of each piece is perfect. This silverware is a great value for money and I would definitely recommend it.
"We really like this set so far. Very heavy duty and rigid. It has been thru several wash cycles in the dishwasher with zero issues thus far. My review is based on one month of ownership, but we are very satisfied."
This flatware has an excellent feel and quality. So far it has held up well and does not get water spots when washed in the dishwasher. We are delighted.
"You never know the weight when you order on line but this set of silverware was stylish, heavy and beautiful."
"Really nice set of utensils. I love the heavy feeling and hammered look. Some ppl have posted that the knives are not dishwasher safe and rust. I dont own one so I can't say, so far hand washing has been fine and easy to clean."
"Great set of silverware. Shiny, heavy-duty, smooth edges, firm fork tongs. So much better than the stuff I was coming across in stores. Love the hammered finish."
they are much more elegant in person. love the way they feel when you hold them. the hammered finish is gorgeous in the light and it is very smooth touch holding the fork and knife. makes everything taste much better ; ) so far it has been the best bargain for stocking our beach rental
"We have used our new set for a week and we love the quality! This set is stylish enough for guests but still durable enough for every day use. The teaspoons are a nice size bowl, perfect in my opinion. As a different reviewer stated, the size and weight feel good in your hand. I am very happy with this brand."
"I received a set of these, and it looks like I received two completely different finishes. One is shiny and one has a brushed finish. The spoons arrived with dings in them and damaged on the outer rim where you'd eat from. Disappointed and returning these."
Comes out of my dishwasher bright and shined like new
This set is gorgeous! It’s better than what I expected. Good value for the money. I’m about to purchase the matching serving spoons 🥄 because I plan on using this set for a long time. Very very satisfied with this purchase.
This cutlery looks refined and is strong enough to be used everyday. Does not get spots after drying.
So pretty and a perfect weight. I even ordered a second set.
"Quality built, nice design. A true pleasure to look at"
"Heavy weight, nice balance, and nice looking. Perfect for use in our motor home kitchen."
I was a little hesitant after reading some of the reviews stating problems with rusting of the knives. I have seen no evidence of this after several dishwasher cycles.
I was very pleased to see the weight and high polish of this set. Attractive design as well. Overall a good purchase.
Denali is a better product. Bigger utensils.
This is great flatware. Great feel. Beautiful look.
Very nice finish and quality. Nice and heavy
"I like flatware with a bit of heft. But not heavy. This is both. The flatware is of good quality, functionality and design. No rust issues. Flatware cleans well in dishwasher. I think I would have spent more money on a quality set like this, so I see the flatware as a good value. We haven't experienced any problems or dislikes."
Set looks great and good value but the knife blade has some give to it and you can bend it with little effort.
I love these. They’re cool looking and sturdy without being too heavy.
So far the flatware is awesome! It is really pretty and very sturdy!
We are very picky about our flatwear. Cheap lightweight flatwear can ruin a meal. This is beautiful and affordable and excellent quality!
"Great product. I wish they offered a serving set that was an exact match. I bought the servers that comes in a satin finish but there was not an offering to match the mirror finish of the flatware. Love the flatware, though!!!"
"Design wise, a couple of corners on handles could be softened"
Lovely place setting I like how our dining table looks with these place settings
Love them!!
"Aunt Deborah Stole my Black Silverware Set  Decided to pick up this unique flatware set for eight to use at a recent dinner party. No one in my family has ever seen stainless steel silverware with a mirror polished black finish before that day. My uncle was the only relative who didn’t care for them. He said the mirror polished made them look fake. Have no idea what he’s talking about? Think my uncle Ray drank too much Corn whiskey that morning.  Each piece in this set has a nice solid weight to it. Beautiful flower laser pattern on the handle adds an air of subtle elegance especially in a formal table setting. The steak knives deliver that final shock factor to anyone seeing them for the first time.  Wish they came packaged in a wooden case, instead of a paperboard box. Product presentation is important to me.  My aunt Deborah really like this flatware set a lot. Didn’t realize how much until the next day when I noticed the paperboard box I put them back in after cleaning was missing. Told me she’ll bring them back in a few weeks. I don’t believe that for this isn’t the first time she covertly “Borrowed” something from my house. Been two years since she appropriated our stainless-steel stockpot in the same fashion.  Just keep your eye on sticky finger relatives if you happen to pull this EUIRIO 48-piece black silverware set with steak knives out for a family get together. Don’t even lend it out for you will never see it again. I promise you that."
"This silverware set is not poor quality but it is not top quality either. Back is just stamped ""Stainless Steel"". There's no logo or brand name. Each piece is fairly heavy and certainly not prone to bend. Knives have the pattern on both sides. Other pieces, only one side. Steak knife handle seems to be made out of some sort of plastic resin. Rivets in the knife handle are well done and heads are flush with the handle. The blade is completely serrated except for the last 3/8"" at the point of the blade.  It seems like this set first had the black finish baked on. The intricate pattern is etched in and therefore reveals the stainless steel finish below. It is a cool look. It will be interesting to see if the black finish scratches or wears off over time. It looks great right now."
"This really weighty tableware. It is not delicate but it is somewhat inspiring. It is not exactly French, nor is it American British Crown influence Victorian. It could have a little of the Muscovite in the design. It even brings forth a hint of the rustic flavor. e sense that it can go with almost any table cloth.  Easy To Clean:  I have used and washed every piece in the set at least three times and it is holding its own so far. I have not really been careful as I wash. Just load the sink with it add my detergent hot water and scrub each piece with a paper towel wad. Noting rubs off and the design is perfectly flat which adds to the ease of washing.  The color has a only the slightest hint of a blue cast so I thought how wonderful to team it up with a set of Mikassa dinnerware that I reviewed.e of months past. (see IMAGE) My only regret is that it did not have a set of butter knives to complete the set perfectly. You can do a simple formal table and do a formal setting with the addition of a butter knife set and ther addition of a bread plate or larger saucer. Ah well, it is not a fault since the seller did not mention a butter knife or include it in the description, It would be nice to know whether a butter knife is available.  STURDINESS:  Again' let me reiterate, it is heavy tableware. It is not dainty and it is not likely ever to bend while in use. The word here is sturdy. I rather prefer the more rugged table utensil and would probably prefer the serrated dinner knives to cut my meat rather than the steak knives that are part of the set. By the way, those steak knives are well made with full tang and three rivets in thke handles of each..  I like this Euirio 48 piece black flatware set with steak knives...a setting for eight. It is a keeper. Order the set and have fun creating striking table settings."
"I love this silverware set! The unique style catches everyone's eye and it adds a layer of beauty to the table. Everyone has silverware, and I've always kept my eyes open to find a way to add some flare, to something that seems to always look the same as what was in my great grandmother's house. This set surpasses anything I could have imagined! Not only are they beauty pieces, they are fully functional. I had some bronze silverware that I was using and I was always told the pieces looked nice, but the salad forks and tea spoons were more like baby utensils and the soup spoons were very flat, not functional. That is not the case here! Every piece is beautiful and functional, even the steak knives are really sharp! The only concern that time will tell is how the pieces hold up through washing. I've been handwashing them and they look great, but I'm sure that my kids will end up getting them in the dishwasher. Also, I'm not sure about sharpening the knives. Still, wouldn't give these up for anything, I love the unique style and the functionality makes these a steal!"
We got this to use in our new home. We decided to start over with a whole new set and this one looked like a great way to do that.  It arrives ready to wash and use. The set also comes in a gift worthy box.  It seems to be well made. The pieces all feel balanced in our hands. The flowers are etched in so they should last as long as the utensils do. The etching is still smooth. There is no hitch or ledge.  They have a nice mouth feel. They were comparable to our stainless steel set to wash.  It is very beautiful in person. We would buy these again.
"This is the most beautiful silverware set I have ever owned. Although I am using them for everyday use, they are pretty and elegant enough to use for a fancy dinner or with your china. They are easily cleaned and seem to be holding up well to use. I love the sizes they give and the quality of each different one. I also love that the set comes with steak knives because usually sets like this do not. I love that it's pretty but also sturdy and they don't feel super light and cheap like some silverware does. I can't imagine anyone being disappointed with this set."
"This silverware set is gorgeous and they are great quality. These would be amazing to use when you have dinner guests over. They will definitely be impressed with this silverware.  This set includes: -8 Large spoons -8 small spoons -8 Large forks -8 small forks -8 knifes -8 Butter knifes  That’s 48 pieces of silverware all together.  Overall, I got all of my pieces of silverware and this set looks as advertised. I have no complaints."
"We were surprised how much we liked this black flatware set! It's really different, yet has an elegant look to it.  The surfaces have a nice, smooth feel to them.  Ours arrived nicely packaged and free from scratches or defects.  At Amazon's current price of around $50, you're really only paying about a dollar per piece. Seems like a great value to me.  Highly recommended!!!"
"This flatware set is gorgeous! I love that the pattern is even on the steak knives, that is honestly delightful. They did not lose their luster or any color/pattern when running them thru the dishwasher either!"
This silverware set arrives well packaged with each piece in its own plastic sleeve and is easy to unpack and start enjoying right away. These pieces are so much prettier in person than the picture. They are beautiful pieces of art. They are comfortable to hold. They are a nice weight and not too thin. We love them so very much and highly recommend them.
"These look really unique. I do put mine in the dishwasher, but I’m careful to only use a soft sponge on them too. They do eventually get some scratches. Nonetheless, they look great and we use them everyday.  Trust you found this review honest and helpful:-)"
"Got these to replace an old set i got from Walmart that had been losing pieces. The designs on these are absolutely beautiful. The pictures online didn't really do them justice. I'm hoping they hold up to wear and washing, but so far so good. They're also thick, sturdy metal, not thin and cheap."
Cutlery so stunning you almost don’t want to eat with it. It’s absolutely beautiful. Well made and a high quality set. This would make a great gift but the packaging is not the best so maybe repackage it with a pretty box and it will be the most awesome gift ever.
"I love this set. The design is beautiful. Well made, sturdy. Look and feel great"
Pretty little pattern. Nice balance. Attractive silverware. Matte set.
I only have good things to say about this silverware set. The design is very luxurious and beautiful it is such a nice quality design that is unique and sophisticated in the design. The black background with white roses is amazing and adds so much character to my kitchen. The pieces are all full sized and each item is well made without scuffs or damage. The material is Stanless steel and beautifully made. This set is designed for special occasions and should be handled carefully for best use. It is recommended to handmade and not use steel wool or hard detergents. These should be dried right away after cleaning. This set is amazing and I love that it has matching steak knives. Buy these if you need a beautiful luxury set for dinner parties or entering. This set is nice enough to be in your China cabinet.
"We've been mixing and matching a couple sets for years now, so seeing this setting for 8 was great. Not only does it include a full set for dining for 8, but there is a beautiful pattern. These have a nice weight to them and seem very well made. Been through the dishwasher a few times now with no noticeable wear and tear other than where two knives hit each other on the serration. I do have a concern about longevity with the finish, as one of our knives new already came with a blemish, but so far no new blemishes. The steak knives seem to have a poorer finish than the rest of the set, so with good care hopefully will hold up as well as the rest of the set. I love the way these look and feel and bought a second set to save for the big get-togethers with family/friends."
