"This set is very basic, which is what I wanted. Exactly as described. I read reviews saying the steak knives rusted after one wash so I was worried. I have washed them numerous times and there is absolutely no sign of rust. Happy with my purchase!"
My wife and I were surprised by the quality of this set The price we paid for this set is fair and worth the money. We bought these for our camper.
"I need more flatware and saw these and thought, why not for the price. I love them, sturdy, stylish and for what I paid a huge steal. They are now my daily flatware."
Very nice set of stainless steel.
"Can not beat this set for the price! The size/proportions are perfect, they have a nice smooth finish and they are well made. I've bought a similar price set at Walmart before that didn't even come with steak knives and it was junk so I didn't have the highest expectations and I was pleasantly surprised at how nice these actually are, especially the steak knives."
Just the right size flatware for a wonderful thanksgiving meal. My grandchildren didn’t have a problem with them and my fingers can hold them well with my arthritis.
I love this silverware set. It’s extremely shiny and I love having an extra amount of forks. The knives are very sharp. I’ve washed them multiple times and haven’t seen any rust (mentioned in other reviews). It’s perfect for a new home.
"You can NOT go wrong buying this silverware!! It is SO worth the money. Usually it's true that you get what you pay for, but I am telling you, this set is worth EVERY penny spent!!"
The silverware is solid and of good quality! Very good value. Buy today!
"This silverware set is immaculate. I’d say they’re medium weighted, good length and just overall great. Those steak knives are SHARP. I opened a pack of hotdogs like I was slicing through water. I don’t think one would be disappointed buying this set."
"These are attractive, smooth, sturdy, and has some weight to them. Totally worth the price."
Overall just as expected. Good quality silverware at a decent price point. Recommend.
"Just moved to a new home and this silverware set was better that I anticipated. They are very sturdy, aesthetically pleasing, and just what my new kitchen needed to complete “the look” I was going for."
Super fast shipping! Great product with all the pieces that I need for when my daughter moves out on her own.
The silverware are thick enough to use and ware well.
Ordered it for my camper great sec great price .
Great set for the price!
Amazing! Just as described! Great quality for the price. I will probably order another set or two to use at work sites!
"This is an awesome set, for the money even better."
very good price good reviews
"Excellent product for the money! Strong, sturdy silverware perfect for starting a home with."
Very good value and quality for the money
Such a great value for the price. All of the silverware has helped significantly with cooking and place setting.
Nice simple very happy
Great product for the dollar anount
"Looks luxurious! Husband wouldn’t believe the price, that’s how you know it was a good purchase."
Just what we needed. Fantastic.!!!
"Very nice set of silverware. It has a good weight, nice polish and easy to clean."
Much better than I had anticipated. heavier and the steak knifes will cut anything...so far :) I would recommend for anyone
Better than I expected! Especially for the price! Sturdy and strong silverware. Would order again.
N/a
The silverware was great and reasonable.
Very good
Like
Exactly what I ordered
This was a great value. Very happy with this purchase. Super fast shipping as well.
This is a great set but be careful with the steak knives...they are extremely sharp. Great for cutting but dangerous when hand washing.. accidentally cut myself 🤦🏽‍♀️😅.
Everything is great except for the knives. The knives are just trash. Don't even bother
Not the best quality of steel. Useful if you don’t have anything else but not good for a fancy or formal dinner.
Sturdy and strong. You get a great product for your money
It’s sturdy silverware but does have some sharp edges on the spoons and stuff. I noticed that a few of them started to get rust spots when I let them dry naturally. I don’t have a dishwasher so I have to hand wash everything. We do have well water with a water softener system but the other silverware in the house didn’t rust. Overall it’s not a terrible deal for what it is. I would buy it again if in a pinch.
The silverware fits my needs
The box was busted open silverware was scratched. Very disappointed.in this order. Make it right..m
These are perfect for my home... They don't bend easy and serve their purpose
The item was exactly as described and a great deal for the price I paid.
"I really think these are great! Lots of silver ware for a great price! The steak knives are really nice. The large spoons are overly large, more like serving spoons. But all in all...Very pleased!"
Cheap material. Steak knives aren’t even sharp. Very disappointed.
I would've love to give this silverware 5 stars but most of them are not polished correctly and the edges are a bit sharp. Hopefully you'll get a set that is properly polished.
There is no way that this cutlery is what is described in the listing. It all rusted after the FIRST wash. We have silverware from IKEA that at least took years to rust. Pretty sure this is the lowest quality possible.  I am returning both sets of these immediately.
Son de muy buen material están muy bien
These silverware set is nice.
Love my new silverware. Perfect weight and strudy. Easy clean and sleek look.
"I recently moved into my very first apartment on my own. As a lot of people know, it can get really expensive really fast. This set was an affordable option and works great. My only complaint is that when left to dry, they get really bad water spots. However, if you know this isn't your forever silverware set that you want to pass on to the grandchildren, this will work just great for you"
"The product seems a good value, but the picture is deceptive because it shows serving utensils. The product DOES NOT include serving utensils so let the buyer beware."
"Was hoping to get a great value, but got exactly what I paid for. This feels like cheap dollar store flatware. The edges feel like they were stamped out of sheet metal and not polished or finished at all. This will be going into the camper for occasional use and don’t care if it gets lost. I would not set my table at home with this low quality ware."
Much smaller than expected and very thin.. but it wasn't expensive so.....
This is good set silver wear as long as your not trying to impress anyone
Nice and sharp but the handle broke
Just a little bulky for the big spoon and forks but I’m going to keep them as my first starter set.
3 stars because this has no dessert spoons or small forks!!
"So I had purchased a well-reviewed set of name-brand black silverware prior to buying these. The 1st set, the black just came off with simple washing. Note, I do not have a dishwasher...so just hand-washing was ruining them. With that frustration, I settled on these. I have had ZERO issue with these, as I tend to wait to review a product until I have had a good chance to use them for awhile. SO, if you are unsure about all the black silverware out there - I would strongly suggest looking into these. They are durable and stunning."
"Perfect flatware for daily use. Sturdy, large and not lightweight like other stuff I have. I just hope the spoons don’t all disappear like my last set!!!"
"Very nice quality of silverware. Does not water spot. Great, simple design. Good price."
I am in LOVE with this set. I bought two to have enough sets for my amount of plates. And love them so far. It's been a couple of months and they clean up just as nice as they did when I bought them. Still the color and shine I look for. And still just as sturdy.  The value is really where I am happy. These were the best valued set I found and at first was worried.... Thinking they would fall apart or the finish would disintegrate.  So far I was wrong. Good set.
The flatware is heavier than I thought it would be. They come out of the dishwasher shiny with no spots. I was concerned about that and relieved. They are a good set for the price
"This flatware is well-made, sturdy, and looks nice on the table. Has had multiple trips through the dishwasher and so far all is well. Very happy with this purchase."
""
"Basically all we wanted was a matching set of flatware because we had a bunch of mismatched knives, forks and spoons from years of marriage. For the money I spent I wasn't expecting anything more than that __just a matching group of flatware! Therefore you can imagine our surprise when we got this product. The sets are beautifully made and look very nice! When washed in the dishwasher none of them spotted or stained! They cleaned up nicely. I feel like I am stealing a little bit because the price was so low! Highly recommend this flatware!"
"II have tried several flatware sets over the years; they have always been flimsy and bend just by looking at them. Until now! Packaging was perfect! No scratches at all! Each utensil was protected, but not to the point where it will take you more than a few seconds to remove the protection. Very nice weight! I will admit that I've never seen a spoon (not the teaspoon) this large. But for me, it's perfect! I highly recommend!"
"I am absolutely amazed by the quality of this flatware! So much quality for under $40.00. First of all, it is beautiful, shines like real silver. Secondly, it is the quality you would expect from a highline not this price point. It is heavy, not cheap stamped on the back flatware.  I bought the 45 piece 2 days ago and turned around and bought the 40 piece today and threw all my old flatware in the trash.  I expect this to be the last everyday flatware I will ever buy."
"I had been looking for heavy-duty silverware with longer forks for a long time - these fit the bill perfectly. They have a good heft to them without being too weighty. I love the size of the tablespoons - almost serving size really and the teaspoons are as big as my old tablespoons. I know some folks said they were too big, but they are exactly what I was looking for. I wish you could buy the forks separately - would love to have another set for that reason but don't need the rest of them. Anyway, I'm happy, happy, happy and if you have hesitated about buying these - don't! Buy them. One more thing, I've put them in the dishwasher many times and they come out perfect."
"Neutral styling maybe modern if anything, clean lines, nice weight, a bit big not for tiny hands but not overly large. Knifes are offset so can cut through without striking your knuckles. Finish is nice shiny looks very nice. Great for everyday use and after a few dishwashes still looks nice. Great value"
"I was very impressed with the thickness and weight of this set. They are a much heavier gauge that the set they are replacing. They may be a little larger than my old set but are by no means bulky. I have used them for a few months and I have not found any that are sharp, rough or have any problems with the finish. I have a black porcelin sink, dinerware set and appliances which they match well. A very attractive set. They do need to be dried or my very hard water will spot them up pretty good however, the same is true with my black sink, dinerware and appliances which I am drying anyway so I would expect nothing less. The fact they look so good after washing and drying them makes drying them seam less of a hassel. I'm very happy with the set and would order again."
Purchased this set to replace our missed matched flatware. The set was complete and I inspected each piece. The pieces are medium weight and sturdy it is a good-looking set. I will pdate in a few months to rate the quality.
"This flatware is beautiful and simple. It can go from everyday dinner table to your elegant Christmas party. The weight of each piece is perfect, not to heavy and not to light. Fits comfortably in your hands. My favorite, the salad fork, is not too big and too small it's just right. This set cleans up well too. We hand wash our dishes so I cannot speak to dishwasher effects. My husband actually said he liked the flatware too...his review...""its not busy, it feels right in the hand."" You won't be disappointed."
"I wanted to wait for some time before I reviewed this tableware. Some of the reviews said that these russt easily, but we have not had any such problem. These are very nice quality items. My husband likes a little heavier tableware (must a guy thing), and he really likes these. They wash up easily and have maintained their original luster after hundreds of washes, both by hand and in the dishwasher."
"I was looking for everyday silverware. I didn't want anything too ""fussy."" When I found this, I liked the design and I liked the price. As an added bonus: the knives actually cut! Usually, all table knives are good for is spreading. These knives aren't going to cut your finger, but they do cut a sandwich without smashing it. This was a wonderful added bonus!"
"I was a little apprehensive buying new flatware sight unseen, but I was really quite pleased with this set. It is way heavier than I thought which was a concern that I would get some flimsy lightweight stuff, not these, they look like they will stand the test of time and will not bend. And just really pretty."
Was very happy with this order. The flatware was heavier then I expected. It came fast and was pack very well. I am proud and happy to give this as a gift. Thank you and will recommend. you to friends.
"Smooth, clean, and weighty. I was surprised by the quality of this cutlery. I've used them for about one month now and I continue to be pleased with the quality. Do not hesitate to buy! A++"
"These are great...You get 8pcs of knives, serving spoon, regular spoons, dinner forks and salad forks. They are sturdy and just the right weight."
"I purchased this set. The pattern was the closest to my current silverware set. It doesn't weigh in my hand as my current silverware does, but it is sturdy, and looks durable, and I think will be a great value for the money. I have been looking for additional pieces to my current silverware and I look forward to using using this set for family dinners!"
"Just started using them, had costly French silverware , course it is all made in China. :((( but like this set, just better NOT rust, as one reviewer stated above. Will be continued......"
I am so very happy with this purchase. I read some of the other reviews and almost didn't order. Silverware has been put in the dishwasher several times since I purchased and it's still beautiful. Sturdy and has some weight to it. Very pleased!
I've been using this flatware for about 2 weeks. There are a good weight without being too heavy (the reason I got rid of my last set). Great size. So far holding up well to dishwashing. Very pleased so far.
I was looking for something different to match my new dishes. This silverware set is it! Sleek looking and functional. Durable and wash well in the dishwasher. Color shines through with no problem of discoloration. Bought additional sets. Also have received lots of compliments.
Love these stainless steel set the best ever strong don't bend cleans great stays shiny wash after wash and the price wow! This set will last me until I will Expire! Timothy Ellis
Amazing for the price! They feel like high end silverware but for a fraction of the cost. These are a nice addition to our camper!❤️
"Durable, shiny, classy. Looks more expensive then they are. Includes great care instructions to keep them in new level appearance. Very happy with product."
"These are probably some of the sturdiest and durable sets of silverware. I was extremely surprised. They are very nice, absolutely love them!"
"I love how shiny and comfortable everything is. I can't believe I got this nice of a set for what I paid. There's only one thing that I was disappointed in and that was the size of the salad forks, but I don't really use those so no big deal. Delivery was fast and it was a no hassle deal. I would recommend this set and this seller."
I bought these for my travel trailer. Love them. Strong and nice looking.
I had to buy anew set as the movers lost our silverware. They are nice looking great price
"I like the size of the utensils, the feel, the weight, I am glad that we purchased these. Worth the money."
This flatware is perfect for my family. The flatware is abused and still holds up like new.
Weight of the utensils Is very important to me. I don’t want the handle to be too thin you think you might break it and I’m not really fond of too much art on the end of Your utensil. I purchased this blind faith from the Internet and got just what I wanted
The bottom of the flatware is wide enough that I can put in my dishwasher and it doesn’t get stuck in the bottom of the rack. Beautiful. Very pleased.
I was surprised at the quality. Sturdy and a good weight which is important in silverware.
"I was so surprised at how lightning fast my order arrived - like, one day! Very nice silverware. Good price too."
Very pleased with this set. They do not appear cheap but instead are sturdy and appear as if they'll last for years.
"I use the flatware for everyday use. The utensils are attractive, highly polished, and sturdy. A good value."
Liked the design. Subdued but attractive.
"They are very well made, and doesn't feel cheap."
Stainless flatware set is very nice. Flatware is sturdy and dishwasher safe. Very satisfied with our purchase.
I was pleasantly surprised to see the high quality of this silverware and I like it very much. Came well packaged too.
"These came on time and were perfect. Not too heavy, well balanced, good sized teaspoons that appear too large but are great, knife is serrated so it cuts well. Would but again for sure."
Good silverware at a good price. Comfortable to use.
Beautiful set of silverware. Very sturdy. Great quality.
Great quality for the money. Purchased two sets as we always run out between wash cycles. Nice to be able to get a nice set of utensils without the extra pieces you never use.
"I haven’t used these much as yet, but I like that they are Plain because food won’t get lodged in between some design, etc"
"I haven't bought a new set of silverware in YEARS. I researched this brand and if course, found it on Amazon. Very, very happy! Easy to clean, sturdy and pretty."
"Looks good and works well, has a good feel to it, i would have preferred shorter handles, forks feel like long handled shovels."
This is a good set for the price. The pieces are large enough and heavy enough. The finishing is good.
Great quality!
"This silverware set is very sturdy. ""Feels"" like the more expensive brands. Is nice because it is a very neutral pattern so goes with everything and comes with a lot of pieces. Very pleased!"
Great silverware. Sleek looking. Would recommend.
"The quality of the whole surpassed my expectations, the price was very reasonable too, I have recommended this to my friends."
"As ""The Kids"" moved away (finally) and got my regular silverware together, I saw that I was missing a lot of them. This silverware is at a great price and very well made. Good weight, all well rounded edges and color as advertised. Just go for them, don't search any longer."
Was thinking it was going to be 'light' but it has a good feel and is sturdy to use. Very happy with our choice.
The flatware arrived as described. Hopefully they will continue to look as nice as they do now.
"We just received this so cannot rate on durability yet, but it matches our current silverware perfectly."
Flatware worked out great love the long & short forks. So far still shining! Would buy again.
Beautiful and classic set.
I’ve been using for a couple of weeks and this flatware is holding up beautifully. It still looks new after several washing in the dishwasher.
The silverware is a beatiful collection for being a plan design
Perfect basic set of silverware. Large and small forks and spoons
Awesome set for the money. Heavy duty and sharp looking too. Love this set. Great value
A gift for my daughter and she is so pleased with them
"Very impressed, sturdy & shiny. As far as durability don’t know, they were just put out a few days ago."
I loved this set of flatware utensils. Very good quality and strong.
Video Player is loading.
These were an AWSOME buy. And it came with the straws which make it the perfect combo. I would definitely recommend
Lovely place setting I like how our dining table looks with these place settings
Love them!!
"Aunt Deborah Stole my Black Silverware Set  Decided to pick up this unique flatware set for eight to use at a recent dinner party. No one in my family has ever seen stainless steel silverware with a mirror polished black finish before that day. My uncle was the only relative who didn’t care for them. He said the mirror polished made them look fake. Have no idea what he’s talking about? Think my uncle Ray drank too much Corn whiskey that morning.  Each piece in this set has a nice solid weight to it. Beautiful flower laser pattern on the handle adds an air of subtle elegance especially in a formal table setting. The steak knives deliver that final shock factor to anyone seeing them for the first time.  Wish they came packaged in a wooden case, instead of a paperboard box. Product presentation is important to me.  My aunt Deborah really like this flatware set a lot. Didn’t realize how much until the next day when I noticed the paperboard box I put them back in after cleaning was missing. Told me she’ll bring them back in a few weeks. I don’t believe that for this isn’t the first time she covertly “Borrowed” something from my house. Been two years since she appropriated our stainless-steel stockpot in the same fashion.  Just keep your eye on sticky finger relatives if you happen to pull this EUIRIO 48-piece black silverware set with steak knives out for a family get together. Don’t even lend it out for you will never see it again. I promise you that."
"This silverware set is not poor quality but it is not top quality either. Back is just stamped ""Stainless Steel"". There's no logo or brand name. Each piece is fairly heavy and certainly not prone to bend. Knives have the pattern on both sides. Other pieces, only one side. Steak knife handle seems to be made out of some sort of plastic resin. Rivets in the knife handle are well done and heads are flush with the handle. The blade is completely serrated except for the last 3/8"" at the point of the blade.  It seems like this set first had the black finish baked on. The intricate pattern is etched in and therefore reveals the stainless steel finish below. It is a cool look. It will be interesting to see if the black finish scratches or wears off over time. It looks great right now."
"This really weighty tableware. It is not delicate but it is somewhat inspiring. It is not exactly French, nor is it American British Crown influence Victorian. It could have a little of the Muscovite in the design. It even brings forth a hint of the rustic flavor. e sense that it can go with almost any table cloth.  Easy To Clean:  I have used and washed every piece in the set at least three times and it is holding its own so far. I have not really been careful as I wash. Just load the sink with it add my detergent hot water and scrub each piece with a paper towel wad. Noting rubs off and the design is perfectly flat which adds to the ease of washing.  The color has a only the slightest hint of a blue cast so I thought how wonderful to team it up with a set of Mikassa dinnerware that I reviewed.e of months past. (see IMAGE) My only regret is that it did not have a set of butter knives to complete the set perfectly. You can do a simple formal table and do a formal setting with the addition of a butter knife set and ther addition of a bread plate or larger saucer. Ah well, it is not a fault since the seller did not mention a butter knife or include it in the description, It would be nice to know whether a butter knife is available.  STURDINESS:  Again' let me reiterate, it is heavy tableware. It is not dainty and it is not likely ever to bend while in use. The word here is sturdy. I rather prefer the more rugged table utensil and would probably prefer the serrated dinner knives to cut my meat rather than the steak knives that are part of the set. By the way, those steak knives are well made with full tang and three rivets in thke handles of each..  I like this Euirio 48 piece black flatware set with steak knives...a setting for eight. It is a keeper. Order the set and have fun creating striking table settings."
