"My fiance and I decided it was time to graduate from dollar store cutlery to the real thing. Love the design, the weight is good, easy to clean and just all around great!"
Absolutely gorgeous set! They are so durable and the design is beautiful . Love the extras that come with it .
I loved these so much I bought a second box of them for parties. They are very nice and the pattern is beautiful. I get compliments from them at dinner parties. Glad I found them for our wedding gift registry. They are awesome.
Just what I needed
"I will be moving into my new house soon and I bought this for that occasion, so I haven't opened it. It is a marvelous price considering it's service for 8 along with serving utensils and steak knives! At less than $1 apiece, you can't go to Goodwill and buy tableware as cheap!!"
This is a very nice looking set if silverware. It's looks very sturdy. If I have any trouble with it after some use I will come back and amend my review. For now I'm very pleased.
"I haven't experienced any of the complaints in these reviews. No rust, good quality and weight- not too heavy. I've washed them in my dishwasher now many times with no issues. I'm very happy with my purchase."
"I love these! I saw them the first time at At Home but they were nearly twice the price there than they were on Amazon. I love pfaltsgraff as a brand, so I hope these last a long time."
"I am really enjoying this set. Love the details, and the quality is great."
"I love this set. The pattern is unique without being over the top. Has a good weight, feels good in my hand. I worry about rust, because it's been mentioned a couple of times in the reviews, but no problems so far!"
Excellent set..this is my second set and very happy with them.
I love this set. For every day use they’re perfect. I’ve received a lot of compliments as they’re a nice looking set.
Very attractive
"I got my first set of these utensils about 3 years ago. I have had no problems with rust. They have discolored a little over time, but still look great. Will continue to use this brand."
"Just as pictured, great quality."
"Product was delivered quickly. Nice, sturdy set of silverware. Love the pattern."
I got this design cause it matches my other set that I got for my wedding present. If you want a set of silverware that is stylish and sturdy then this is the set for you. This is a great product with super fast delivery.
"the finish on one of the forks has worn off in sections and it’s showing signs of rust. We are very fussy about keeping our flatware clean. It gets rinsed, goes in the dishwasher, gets dried if needed, and then put away. The only thing that I can think of is that the underlying metal is defective.  The photos shows the rust (orange brown) and the underlying metal (black).  We bought them on Dec. 12, 2019 so we got 3 months use. Fro this much money, that's insane.  I’m very displeased."
"I waited to write this review until I’ve used these a while since some reviewers noted problems with rust, and I’ve had them a year now. I’m delighted and relieved to find none of these problems. They are a good weight, comfortable to hold, and stand up well to washing in the dishwasher. I’m pleased with how well they pair with my Fiestaware dishes since the banding echoes the stripes on the dishes."
Wow we are completely thrilled with these! We were looking for a quality set of flatware in stainless steel. This is am amazing set that is absolutely worth the money. Substantial weight that won't bend your spoons in the ice cream if you know what I mean! Really extremely well made and nice. THANKFUL to have found these! Fast ship too. Thrilled! Would also make an outstanding gift for the couple just starting out. Wish I had found sooner so we could have enjoyed longer!! But so happy to have them.
"I have bought and paid for 4 separate sets of stainless steel flatware since December looking for a regular set of silverware! It's the standard size and weight of the flatware we have always bought since keeping house for the last 46 years!! It isn't the glamourous set for fine dining but it will work! This flatware has a high gloss finish that is beautiful and holds up after running through the dishwasher. Most delightful of all it has the weight and balance that a good set of flatware should have. Another plus, it's not made in China!"
These seemed nice out of the box but quickly discolored with black spots all over them. Amazon customer service is useless concerning this item. Do not buy.
I love this flatware. Feels good in the hand. I like that it's slightly oversized. It is a classic design that works for casual or special occasions.
"We asked for this set for our wedding - as our everyday flatware set. So far - we love them! They're simple but elegant - and we love the brushed look! The serving utensil set is on the smaller side, but we're fine with that - for everyday usage for the two of us - the set is perfect!"
I love this set. It's pretty to start. It really enhanced the dining room table for Thanksgiving. The weight and balance is perfect and you actually feel like you are holding a utensil that screams quality. I bought it for the holiday table but it's great for everyday use I just can't get myself to stick it in the cutlery drawer so I'm not using it everyday yet. Haha I like this item a lot.
"I have ZERO idea why anyone would not give this flatware a 5 star out of 5. It is shiny, it is sturdy, it is heavy, it is sized well and it has a very classic design which can be paired with everyday plates to fine China. It is superb!"
"Very nice flatware, nice heft, shiny and doesn't appear to scratch easily. Made of the highest grade of stainless steel used in the industry. Very pleased with the purchase. Don"
"Feared buying without feeling the pieces, but counted on Mikasa name and ordered. The weight is substantial which will lead to durability and the pattern is perfect for our needs. For 12 place settings and serving pieces, one cannot beat the price."
I’m a younger guy never thought I’d be excited about silverware but I am. This brand is fantastic very sturdy and looks amazing I’ve never used good silverware before but I got a new place and wanted to upgrade. Definitely made the right choice. I loved them so much I ordered 3 sets as gifts for my close family. Best brand ever worth the money
"Great value for a really quality set of silverware. I bought an extra set because we bought a house that had an extra kitchenette in the finished basement by a bar. It will be a great set for entertaining. My husband likes it better than our everyday silverware, but I like the style better, so we put it in the downstairs kitchen. Will have plenty for entertaining now."
"Ordered and received same day. Appear to be of high quality with a polished shine. There are no markings on the silverware. The box says made in Vietnam. I am assuming they are packaged for a number of different companies, thus no markings. Time will tell. Happy with purchase."
I bought this set after we lost a few pieces from a move. I am so pleased. The set is quite sturdy. Just heavy enough that it doesn't have that cheap feel. The set stands up to everyday use and lots of washing with no tarnishing. I am also very pleased with the serving pieces that come with the set. Overall it is a great value for the money. I would have expected to pay double for this quality
I am very happy with the Mikasa stainless that I got. I was a little surprised at the size of the forks but they’re OK. They are just larger than the very old styles. The silverware is a perfect weight with a beautiful finish. I would buy it for a gift or highly recommend it.
"I love this flatware. It is beautiful, has a nice weight and very reasonable for the price. Look forward to using it every day."
I love the weight and shine of this silverware. It feels good in the hand and compliments my dinnerware nicely. It can be used with good china as well as daily place settings. It's very versatile and a good value. I highly recommend it!
This silverware is beautiful. I am using my regular dishwasher detergent and so far not the slightest hint of rust. Very please.
"Very nice weight and I love all of the pieces. I was surprised by how large the larger spoon is (almost like a serving spoon, in my opinion) but it doesn't bother me. It's hard to tell in some of the pictures but the finish is shiny. We are very happy with the set!"
"This is the nicest silverware that I’ve ever owned, even though I have had 18.1 sets before. Just love them and can’t wait to entertain!"
very sturdy.. does not get rust spots when hand or dishwashed. buy this product.
"Absolutely what I expected from Mikasa. Similar quality to Oneida, very lovely to look at and hold. This specific pattern is on the larger side, so be sure you prefer that."
"These are solid, with a nice, simple pattern, with just enough style. Beautiful shine! Love my new flatware!"
"I love these, they are a nice weight and look great on my table. A very good value for the money!"
Nice quality with style. Made very well that I would compare to pier one silverware. Very happy with this set
"Mikasa dinner ware (plates, glasses and utensils) never fail to be really great quality, beautifully crafted, and a great value. I've bought Mikasa over the past 30 years, for myself and for gifts."
"A little pricey but, beautiful, smooth silver finish makes the price more bearable."
"This is a really nice looking flatware. It is much heavier than previous flatware I have owned. Also it is longer. The basket in the dishwasher does not support it as well. Sometimes it must be adjusted in the basket to push the rack in. Overall, happy with it & makes a nice table setting."
"I was looking for a product to replace my current everyday silverware. This set is great. It is not too heavy, but not so light that it bends. All pieces fit perfectly in the dishwasher silverware holder and have been holding up great (about a month). Loved that it was a 12 place setting set."
"No regrets, the description is very accurate and the quality is very good."
"Solid, sturdy, classy, and functional. They clean nicely in the dishwasher and have a nice weight to them."
We wanted a heavier set of silverware with a wider handle as my husband's hands shake. He approved them as they work great for him (me too😉)We use them for everyday silverware. We wash them by hand and they stay so shiny ✨️.
"We love this set of flatware. It’s even better looking in person. I was concerned by reviews that the forks might be too big, but we love them. The salad fork is a little bigger than our old ones but I never used my old salad forks because they felt too small. These feel really good in my hand. The knives are sharp and are holding up well with daily use. Great purchase."
The Mikasa Harmony set has been the best silverware set we have owned over the past 40 years we have been married. Wish we would have purchase them from the start!
Was exactly what we were looking for. Very durable and great price!!
"I’m very choosy and I love the silverware! It’s simple, yet elegant. Sturdy, yet light weight, would highly recommend it!"
These are a great value! They are well made and have a great feel. I wish they had a serving set to match. ( the set comes with a set of serving pieces)
Nice weight and feel
This set is heavy and well-balanced. It’s a very good value.
Not sure what all the rust complaints are all about. We use the dishwasher everyday and have no rust or spots on this set. High quality for everyday use. Very happy with our purchase. Highly recommend buying this set.
This is the shiniest silverware I've ever seen. The pictures do not do it justice. Nice and heavy too.
"I love this set. It has a nice weight to it and is ""balanced"". If you are considering this set, I recommend purchasing. Looking for extra spoons as we always seem to lose one or two."
I love the heaviness of the silverware and the design. We wanted the most pieces available in a set with serving utensils. This is a great deal and exactly what we wanted.
Well made and much sturdier then any of my previous silverware. I very happy with my purchase. Washes and dries well in dishwasher.
"Really good quality, very strong and dont stain"
Super nice set! Very elegant and worth every penny!
For everyday use
Beautiful design. Sturdy feel. Looks great with any dish set.
Holding up well and looking great. Heavy duty stuff. We love them!
Beautiful flatware and just what I wanted.
"This set is exactly what I wanted, and exactly what was promised. Heavy, shiny, really nice!"
I gave thud set to my son who recently moved into his own home. He is happy with it and it's very easy maintenance. Successful gift!
"The silverware arrived nicely packed. All pieces were individually wrapped. The pieces are a heavy weight, and the design is beautiful. The forks and spoons are fairly large, compared to my old set. They will look great even with fancy dinner on my china!"
We found this silverware at Bed Bath and Beyond and we picked it for our wedding registry but ended up buying it on Amazon because of the cheaper price. This silverware is heavy and is great quality.
Nice quality and finish
Love the sleek lines. Its beautiful and simple lines make it look like fine silverware.
"These are beautiful, simple but elegant. These have a wonderful weight and are good quality, highly recommend."
WON'T BE DISAPPOINTED
"Nice, heavy weight flatware I bought a few sets for a dinner party and really like it. I would recommend this if you dont want something that feels cheap."
"LOVE LOVE LOVE these!!! They are the perfect weight.....a little heavy, but that is what I was looking for! Very pretty and great for everyday use."
Love this set Beautiful mirror finish. Great weight. So happy I purchased!
"Wasn’t what I expected.,"
If you like heavier and larger utinsils these are perfect. I have run them through the diswasher several times and they still look new.
Loved the silverware. Definitely recommend it and will ordered again. Ordered for our vacation home and hubby liked it better than what we have at home.
Love the set. Finally I have a nice placesetting. BEAUTIFUL.
We love our new everyday silver. Took a couple weeks to decide. After a great deal of research we landed here and love it! Heavy and many pieces. Have washed several loads of dishes and no issues at all!
Value for money
I was very pleased with the quality and heaviness/sturdiness of this Mikasa flatware. It's so shiny and beautifully smooth. No rough edges and every piece was perfectly made. Been using it a month now and I still LOVE IT!!
"Sturdy, as advertised."
"I am not sure what happened to my last set of silverware, but in the course of the last year or so, most of my spoons went AWOL. I sort of expected it when I had a toddler, but that never happened. Now that he's a teenager, spoons are suddenly scarce. That's in addition to the several that took rides in the disposal, since no one actually looks before they push the button.  I wanted to have more than three spoons in my three person household, but didn't want to spend a fortune in case this trend of silverware abuse/theft continued. I took a chance on this set since it's so well reviewed.  It's easily better quality than the more expensive Farberware set that it's replacing. It's also better reviewed than that set, which I'd been debating buying to just add to the remaining pieces I have. It's heavy, doesn't stain or rust in several runs through the dishwasher.  Overall, I'm really pleased and pleasantly surprised!"
"I bought this product for my daughter, who moved into her own apartment last week. It looked very nice online, but I was worried it would be less than acceptable once I saw it in person. Surprise! It was wonderful craftmanship, really lovely quality, simple, elegant, and such a terrific price. My daughter loves her new flatware, and I'm going to order another set for myself! Sarah A."
Lov my silverware it stat shiny after as many times as I clean an reuse it I recommend that anyone purchase this one it's a great deal durable an awesomely cleans nicely
"Bought these to use in a short-term rental. I needed something inexpensive enough that I could buy an extra set to occasionally replace missing pieces, but also nice looking and durable.  They feel a bit thin, but they're actually quite strong. The look is elegant and simple. No rust or anything after a 5 months of use. They are exactly what I needed.  UPDATE after 18 months of use: I occasionally get rust spots on the knife blades. Only the knives and only on the blades, not the handles. This happens when the knife is either laid in the stainless steel sink or left in the dishwasher touching other steel utensils while wet. It's obviously some galvanic corrosion due to dissimilar metals. The rust comes off relatively easily, but leaves behind spots on the blades that are no longer polished.  Also, I bought a second set and noticed in that set there are two forks that are bent slightly different from the others from the factory, so they don't stack nicely."
"I purchased these as a gift for a family member; it was a holiday dinner and I knew they didn't have enough flatware for everyone that was visiting. I washed the set in advance and was quite impressed! This flatware is very substantial, especially for the price. I prefer the stainless without the nickel. The nickel is what creates the grey marks on your dishes. I almost prefer this set to my name brand flatware. I would buy these again."
"Sleek and basic design and sturdy. I have problems eating ice cream with some of the cheaper brands(they bend). My kids have this weird tendency to accidentally throw away silverware while clearing their plate, so yet again I had to purchase more. I would buy this brand again for the sturdiness. I didn't need the extras such as the sugar spoon and butter knife, but I suppose they're nice to have extras of as well."
"I've had the set for a few months now. They are sturdy and really great for the price, no complaints. Though the large spoon and fork are VERY big haha"
Great quality flatware at a great price. Has nice weight to it and feels good in your hand.
"These are fantastic!! I had recently bought a couple of different sets that were high end, 18/10. Wanted the best. They rusted or where scratched and had to send them all back. I found these for much cheaper and they have been great. Been using for a few months now and still very happy. Easy to clean, dishwasher safe, sturdy and solid. Great Product! Thank you!"
"As a rule, silverware is silverware. However I recently changed residence and somehow my silverware was either forgotten and left behind or during the unloading of the van it grew legs and walked off. I ordered your silverware because it was pretty and matched my dinnerware. We suffered with plastic until it arrived and when it did I was amazed at how pretty, well-made and sturdy they were. Thank you, thank you, thank you!"
"I purchased the Brightown 45-Piece Silverware Flatware Cutlery Set originally to replace pieces I had missing in my own set. But the Brightown made all the other old flatware in my drawer look old and dull so I removed all the old and placed my new Brightown. It's made very well. Sturdy pieces. beautiful and sleek, and I received my product within 2 day - Kuddos to the Customer Service Team for that. I'm so happy with my purchase and I highly recommend this set for anyone looking to replace their old set. Beauty and affordability. Brightown will be my go-to for flatware in the future."
"Love the simple lines, looks great with any type of dish. cleans up beautifully, and have no problems showing it off!! The price was wonderful for all the extra pieces that were included.. Would recommend this product."
Great set! Plain silverware at a reasonable price.
"I’m actually very impressed by this flatware set. I was looking at Kohl’s, Target, Walmart, and Amazon all at the same time, trying to find a decent quality for a decent price.  This was it! We have plenty of pieces for our family plus some. It’s a nice weight and feels durable. I went ahead and threw them in our dishwasher to check how they did. All washed great!  So far, we are very pleased with the look and functionality.  I read all the reviews before buying (yeah I am that person), go ahead and order! You can get them in 2 days and you won’t regret the quality at all."
"Absolutely love this silverware, sturdy, easy to clean, beautiful durable shine, quality workmanship, and extremely comfortable to use. Comfortable in the hand, extremely smooth to the mouth and lips, no rough or sharp edges. Actually this flatware has surpassed my expectations, I wanted flatware to replace the mismatched ones we were using to a standard set. Reviewed quite a few, looked and looked until I see these on Amazon. Caught my eye, upon review I read the maker takes pride in the flatware smoothness / luster / and workmanship, let alone they show a micrometer helping explain the sturdy structure of the flatware. Yes, I recommend the purchase of this product, no second thoughts about it."
"I bought this set thinking it would likely turn out to be pretty crappy, given the low cost. I was swayed by the reviews and took the plunge and I’m thrilled to report that this is indeed a great set of flatware. I’ve used them for at least a month now, tossing them in the dishwasher with each use, and they’re great! No issues. They’re a nice weight, no rust, no problems at all. I highly recommend."
"Hard to beat a full service for 8 at this price. As my review title says, these are not at all fancy but a great set for everyday use. They are well made and haven't had any issues running them through the dishwasher. We actually ran them in the dishwasher before the first use and they came out fine. The set was complete, along with the serving set, and no defects. Each piece was individually wrapped in a plastic sleeve. Seller's description is accurate and the set lives up to the claims."
"Exactly what I was shopping for: no frills, sturdy, utilitarian, mid-class resto quality. But a bit over-sized, for my tastes (admittedly, I did not look closely at the specs), and the larger forks are almost...weapon-worthy. The smaller of the two types of forks are the same size that I (gen-x) knew as the larger fork. I mean, the tines, from the point to the curve, on the *small* fork, are almost two inches long, which is a hair longer than the large forks of my vintage set. (A suitable choice of cutlery for such dark times, I guess, but this review isn't about feudalism, overt consumption as a power move, or the bleak history following either--these are just really big big forks). Oh, the handles do smudge quickly, so be prepared to lightly buff the handles after you set table for company, if you're persnickety."
"I thought that I was ordering some replacement flatware to ""get by"" since my family and I were long overdue in purchasing new flatware after an out of state move last year. I thought that I was purchasing something to hold us over until I had a chance to shop for some upscale replacements perhaps during the holidays or during online Black Friday deals. So, I made the plunge and ordered this flatware set. My family and I are MORE THAN pleased with our purchase. The only thing that I am upset about is taking so long to find and order this set before now!"
"They are huge, Jerry huge. The salad fork is a lethal weapon. The butter knives barely fit my utensils organizer. They are strong, ice cream didn't bend my spoons and it was frozen solid. So it might take you a few uses to get use to the size. The style is pretty much minimalist as they are pretty basic in design. They are one of the better sets I have used for strength. I hate weak neck utensils."
"We just received the silverware and we absolutely love it. The appearance is great and it looks like it will retain its appearance due to the finish. The weight is perfect, not light but no too heavy to be uncomfortable. We have not had the set long enough to evaluate the durability, but I will update after we have had it for a while. I would recommend this set."
"These are nice pieces of flatware for everyday use. There are not overly ornate; they are just useful. I didn’t want feminine flatware, and these fit the bill. They have a great balanced feel to them and therefore don’t feel cheap. It is a great plus that they are are dishwasher safe. I cannot imagine that anyone would be disappointed in them. I expect that they will last many, many years since they seem to be so well constructed. An added bonus: the set comes with a few extra pieces not found in most sets. Check out the details online."
"This flatware is unique and elegant in design, weight and thickness- made of 18/0 stainless steel with a glossy mirror finish and a slightly elongated handle which make them well balanced and easy to grip. I am replacing my current flatware and was extremely pleased when I received this 45 piece set of Brightown flatware! It’s just what I was looking for."
"My flatware arrived yesterday and I was so pleased. The pieces are a nice size and feel comfortable and substantial in the hand. The finish is smooth and bright. They appear to be very well made, and the price was great. Can't wait to clean out my old silverware drawer today and donate them so I can start using these new ones. They'd make a great gift!"
